{
  "format": "equationwright-build-manifest-v1",
  "schemaRevision": 1,
  "buildToolVersion": "1.0.0",
  "sourceRevision": "example-source-revision",
  "encoding": "utf-8",
  "lineEndings": "lf",
  "moduleOrder": [
    {
      "order": 1,
      "path": "src/shell/document.html",
      "role": "html-shell",
      "sha256": "sha256:0000000000000000000000000000000000000000000000000000000000000000",
      "determinismCritical": false
    },
    {
      "order": 2,
      "path": "src/styles/base.css",
      "role": "style",
      "sha256": "sha256:0000000000000000000000000000000000000000000000000000000000000000",
      "determinismCritical": false
    },
    {
      "order": 3,
      "path": "src/styles/mobile.css",
      "role": "style",
      "sha256": "sha256:0000000000000000000000000000000000000000000000000000000000000000",
      "determinismCritical": false
    },
    {
      "order": 4,
      "path": "src/styles/scratchpad.css",
      "role": "style",
      "sha256": "sha256:0000000000000000000000000000000000000000000000000000000000000000",
      "determinismCritical": false
    },
    {
      "order": 5,
      "path": "src/core/version.js",
      "role": "core",
      "sha256": "sha256:0000000000000000000000000000000000000000000000000000000000000000",
      "determinismCritical": true
    },
    {
      "order": 6,
      "path": "src/core/determinism.js",
      "role": "core",
      "sha256": "sha256:0000000000000000000000000000000000000000000000000000000000000000",
      "determinismCritical": true
    },
    {
      "order": 7,
      "path": "src/core/math-text.js",
      "role": "core",
      "sha256": "sha256:0000000000000000000000000000000000000000000000000000000000000000",
      "determinismCritical": true
    },
    {
      "order": 8,
      "path": "src/catalog/units.js",
      "role": "catalog",
      "sha256": "sha256:0000000000000000000000000000000000000000000000000000000000000000",
      "determinismCritical": true
    },
    {
      "order": 9,
      "path": "src/catalog/generator-registry.js",
      "role": "catalog",
      "sha256": "sha256:0000000000000000000000000000000000000000000000000000000000000000",
      "determinismCritical": true
    },
    {
      "order": 10,
      "path": "src/catalog/topics.js",
      "role": "catalog",
      "sha256": "sha256:0000000000000000000000000000000000000000000000000000000000000000",
      "determinismCritical": true
    },
    {
      "order": 11,
      "path": "src/semantics/stats.js",
      "role": "semantic",
      "sha256": "sha256:0000000000000000000000000000000000000000000000000000000000000000",
      "determinismCritical": true
    },
    {
      "order": 12,
      "path": "src/semantics/logic.js",
      "role": "semantic",
      "sha256": "sha256:0000000000000000000000000000000000000000000000000000000000000000",
      "determinismCritical": true
    },
    {
      "order": 13,
      "path": "src/semantics/differential-equations.js",
      "role": "semantic",
      "sha256": "sha256:0000000000000000000000000000000000000000000000000000000000000000",
      "determinismCritical": true
    },
    {
      "order": 14,
      "path": "src/generators/hp.js",
      "role": "generator",
      "sha256": "sha256:0000000000000000000000000000000000000000000000000000000000000000",
      "determinismCritical": true
    },
    {
      "order": 15,
      "path": "src/generators/p283.js",
      "role": "generator",
      "sha256": "sha256:0000000000000000000000000000000000000000000000000000000000000000",
      "determinismCritical": true
    },
    {
      "order": 16,
      "path": "src/generators/s245.js",
      "role": "generator",
      "sha256": "sha256:0000000000000000000000000000000000000000000000000000000000000000",
      "determinismCritical": true
    },
    {
      "order": 17,
      "path": "src/generators/s155.js",
      "role": "generator",
      "sha256": "sha256:0000000000000000000000000000000000000000000000000000000000000000",
      "determinismCritical": true
    },
    {
      "order": 18,
      "path": "src/generators/st2.js",
      "role": "generator",
      "sha256": "sha256:0000000000000000000000000000000000000000000000000000000000000000",
      "determinismCritical": true
    },
    {
      "order": 19,
      "path": "src/generators/qr.js",
      "role": "generator",
      "sha256": "sha256:0000000000000000000000000000000000000000000000000000000000000000",
      "determinismCritical": true
    },
    {
      "order": 20,
      "path": "src/generators/ac1.js",
      "role": "generator",
      "sha256": "sha256:0000000000000000000000000000000000000000000000000000000000000000",
      "determinismCritical": true
    },
    {
      "order": 21,
      "path": "src/generators/ac2.js",
      "role": "generator",
      "sha256": "sha256:0000000000000000000000000000000000000000000000000000000000000000",
      "determinismCritical": true
    },
    {
      "order": 22,
      "path": "src/generators/de.js",
      "role": "generator",
      "sha256": "sha256:0000000000000000000000000000000000000000000000000000000000000000",
      "determinismCritical": true
    },
    {
      "order": 23,
      "path": "src/generators/dm.js",
      "role": "generator",
      "sha256": "sha256:0000000000000000000000000000000000000000000000000000000000000000",
      "determinismCritical": true
    },
    {
      "order": 24,
      "path": "src/generators/d289.js",
      "role": "generator",
      "sha256": "sha256:0000000000000000000000000000000000000000000000000000000000000000",
      "determinismCritical": true
    },
    {
      "order": 25,
      "path": "src/generators/la.js",
      "role": "generator",
      "sha256": "sha256:0000000000000000000000000000000000000000000000000000000000000000",
      "determinismCritical": true
    },
    {
      "order": 26,
      "path": "src/generators/ca.js",
      "role": "generator",
      "sha256": "sha256:0000000000000000000000000000000000000000000000000000000000000000",
      "determinismCritical": true
    },
    {
      "order": 27,
      "path": "src/generators/trig.js",
      "role": "generator",
      "sha256": "sha256:0000000000000000000000000000000000000000000000000000000000000000",
      "determinismCritical": true
    },
    {
      "order": 28,
      "path": "src/generators/pc.js",
      "role": "generator",
      "sha256": "sha256:0000000000000000000000000000000000000000000000000000000000000000",
      "determinismCritical": true
    },
    {
      "order": 29,
      "path": "src/generators/c1.js",
      "role": "generator",
      "sha256": "sha256:0000000000000000000000000000000000000000000000000000000000000000",
      "determinismCritical": true
    },
    {
      "order": 30,
      "path": "src/generators/c2.js",
      "role": "generator",
      "sha256": "sha256:0000000000000000000000000000000000000000000000000000000000000000",
      "determinismCritical": true
    },
    {
      "order": 31,
      "path": "src/generators/c3.js",
      "role": "generator",
      "sha256": "sha256:0000000000000000000000000000000000000000000000000000000000000000",
      "determinismCritical": true
    },
    {
      "order": 32,
      "path": "src/engine/selection.js",
      "role": "engine",
      "sha256": "sha256:0000000000000000000000000000000000000000000000000000000000000000",
      "determinismCritical": true
    },
    {
      "order": 33,
      "path": "src/engine/multiple-choice.js",
      "role": "engine",
      "sha256": "sha256:0000000000000000000000000000000000000000000000000000000000000000",
      "determinismCritical": true
    },
    {
      "order": 34,
      "path": "src/engine/render.js",
      "role": "engine",
      "sha256": "sha256:0000000000000000000000000000000000000000000000000000000000000000",
      "determinismCritical": true
    },
    {
      "order": 35,
      "path": "src/protocols/capabilities.js",
      "role": "protocol",
      "sha256": "sha256:0000000000000000000000000000000000000000000000000000000000000000",
      "determinismCritical": false
    },
    {
      "order": 36,
      "path": "src/protocols/blueprints.js",
      "role": "protocol",
      "sha256": "sha256:0000000000000000000000000000000000000000000000000000000000000000",
      "determinismCritical": true
    },
    {
      "order": 37,
      "path": "src/protocols/diagnostics.js",
      "role": "protocol",
      "sha256": "sha256:0000000000000000000000000000000000000000000000000000000000000000",
      "determinismCritical": false
    },
    {
      "order": 38,
      "path": "src/protocols/replay.js",
      "role": "protocol",
      "sha256": "sha256:0000000000000000000000000000000000000000000000000000000000000000",
      "determinismCritical": true
    },
    {
      "order": 39,
      "path": "src/protocols/profiles.js",
      "role": "protocol",
      "sha256": "sha256:0000000000000000000000000000000000000000000000000000000000000000",
      "determinismCritical": true
    },
    {
      "order": 40,
      "path": "src/adaptive/smart-review.js",
      "role": "adaptive",
      "sha256": "sha256:0000000000000000000000000000000000000000000000000000000000000000",
      "determinismCritical": true
    },
    {
      "order": 41,
      "path": "src/adaptive/history.js",
      "role": "adaptive",
      "sha256": "sha256:0000000000000000000000000000000000000000000000000000000000000000",
      "determinismCritical": false
    },
    {
      "order": 42,
      "path": "src/adaptive/ai-boundary.js",
      "role": "adaptive",
      "sha256": "sha256:0000000000000000000000000000000000000000000000000000000000000000",
      "determinismCritical": false
    },
    {
      "order": 43,
      "path": "src/ui/controls.js",
      "role": "ui",
      "sha256": "sha256:0000000000000000000000000000000000000000000000000000000000000000",
      "determinismCritical": false
    },
    {
      "order": 44,
      "path": "src/ui/quiz.js",
      "role": "ui",
      "sha256": "sha256:0000000000000000000000000000000000000000000000000000000000000000",